,text,author,visibility,_id,recipient_name
0,"Chii kitna noob banda hi re.. itna acha phone kya krega rakh k.. mereko dede.. pubg ka nam duba dis.

Bada admi h ab .. sponser krna thoda :P",Shreyansh  Yadav,True,60a5ed71819323d199d48803,Anuj Mayurkumar Shah
1,"Tu mereko sabse chill banda lagta hai.. koi tension hi ni rehti aisa lagta dekhne se.. iisc ki canteen kitni bekar thi... itni lambi line m lage raho...then lab m jake sample ghisso..  
bangalore ka bhi apna hi maza tha.. P.S us din us museum m sahi m ni suni thi ringtone :P silent p tha 

And teri toh bandi bhi ban gyi thi bangalore m haina :P",Shreyansh  Yadav,True,60a5e900819323d199d487e6,Kushagra Gupta (R Gupta)
2,"Yo Hardik!! Tere se lawn tennis seekhna tha yar.. tym hi ni mila .. abhi to jab bhi marta hu .. ball seedha bahar jati h lawn k (lagta h kisi aur se seekhna ladrega ab).. :P
🤣

Tere sath m first tym L7 m baitha tha.. jab wo counselling wale harassment ka samjha rhe the.. wo bhi kya din the..

4 sal ho bhi gye pata hi ni chala..
Milenge kabhi🤩
",Shreyansh  Yadav,True,60a73968819323d199d491e7,Maloo  Hardik
3,"Har class me inner me-  Ye saala kitna doubt poochta hai.. 
pr sirji na canada gye na bakiyon ko jane dia...  ek trip jo sath m ho sakti thi wo bhi ni ho pai ..

phir kabhi hi sahi.. 

MSE313A m ladai achi thi Nischay k sath :P",Shreyansh  Yadav,True,60a5ec42819323d199d487fb,Prakhar  Dhakar
4,"Yo launde.. yahin to yadein hai.. 10th sem tk banengi abhi to

Ek reh gyi..7th sem wali (kaustabh sirji ki)
SIR YOU ARE NOT AUDIBLE :P 

",Shreyansh  Yadav,True,60a73784819323d199d491e5,Rohan  Verma
5,My first impression was ki ye wo ladka h na jo Phool patti muh p laga k photu dalta hai fb pe and profile bhi lock rakhta hai... battlegrounds m toh machaenge.. ek advise... wo Shobhita wali ID se login krke LOVER wala partner de de.. :P (cool dikhunga na :P),Shreyansh  Yadav,True,60a5e6ec819323d199d487db,Shobhit  Sachan
6,"Chahe wo Solar m cheating krna ho 😳.. ya Kisi ko ALL THE BEST bolna.. sab in bhaisahab ni kia hai



Sare assignmnet to ban hi gye.. ab theisis aur hai.. wo bhi nipat hi jaeygi 😂.

P.S : cheating krna achi bat ni bhai😤 

",Shreyansh  Yadav,True,60a73b5e819323d199d491e8,Ujjwal Pratap Singh
7,Pehle bar dekha toh socha shareef ghar ka h.. shant sa... phir Vineet k sath dekh lia... samjh gya ye bhangar banda h :P Anyways aise hi sahi ho.. hasmukh typ <3 . Antaragni m toh chal hi rhe the tedhe medhe . :P,Shreyansh  Yadav,True,60a5eae3819323d199d487f1,Vishal  Agarwal
