,text,author,visibility,_id,recipient_name
0,"Yeah boiiiiiii, also great dancer!",Vatsalya  Tandon,True,60a4ac27819323d199d48186,Akshat  Agrawal
1,Aur bhai Shubham hahahaha. Great times!,Vatsalya  Tandon,True,60a648eb819323d199d48d8f,Anuj Mayurkumar Shah
2,mathemagic kya kya hua????,Vatsalya  Tandon,True,608d9db2819323d199d47694,Ayush Gupta (S Gupta)
3,Surya Ast Punjabi Mast,Vatsalya  Tandon,True,60a8cae8819323d199d493ba,Bhavjeet  Singh
4,25 thi ya 26?,Vatsalya  Tandon,True,60977e8f819323d199d47852,Tushar  Goswamy
