,text,author,visibility,_id,recipient_name
0,"Bro tu hamesha haste hue milta tha and hope ki aage bhi hassi barkarar rahegi. Touch mein rahio bro, Vishal Agarwal",Vishal  Agarwal,True,60a65b4d819323d199d48ed2,Aakarsh  Singh
1,"Bihari mc koi meri buri yaade taaza karvae ya na karvae tu zaroor karvata hai 😠. But beti yahi toh tujhe unique banati hai yr, tu jaldi bhag gaya sale aakhri dino mein nahi toh pelte tereko bc. Aur tera woh human values ke upar ka lecture aur tere beliefs toh mai kabhi nahi bhulunga :p. Dekh mere ‘bete’ milna toh hai bc, ab koi randapa nahi chalega toh bc maal bechana band kar aur jaldi aa ja. Love you bhai, Vishal Agarwal",Vishal  Agarwal,True,60a6128b819323d199d489fd,Abhishek  Kumar
2,"Yo Bro,
Was it 2nd or 3rd year labs?? Doesn’t matter bhut maje kare tere aur asati ke sath….aacha lab group ban gaya tha yaar aur jo readings mein fraud mara with your statistical non-existing readings kasam se maja hi aa gaya tha bhai. Duaon mein yaad rakhio bro, Vishal Agarwal
",Vishal  Agarwal,True,60a572c6819323d199d48676,Aman Raj Singh
3,"Bahubali wait wht?? Kyu bc tere se jyada toh mai hi lift kar leta hu :p. But tere se baat karke aur tereko jaan kar samajh aaya ki tu life ke varying topics par kitna mature hai. Bada maja aai bro tere se mil kar and teri harami wali hassi jab apan dinner talks karte sanghi ke life philosophy par woh mai kabhi nahi bhulunga. Hopefully milna hoga apna tab tak aise hi harami panti mein rahio. lots of love to you bro, Vishal Agarwal",Vishal  Agarwal,True,60a64e7f819323d199d48df3,Amrendra Pratap Singh
4,"Sanghi bhai,
Tere sath dinner talks aur tere life goals par discussion par khub bond kiye bhai apan. Tera chaapna toh first year se dikh raha tha but tera modest aur humble behaviour dekh kar ek alag level ka respect develop hua tere liye. Mai aaunga tere ghar huderabad mein ghar ki biryani khane, tab tak chaapte raho. Lots of love to you bro, Vishal Agarwal
",Vishal  Agarwal,True,60a56e03819323d199d48652,Aniket  Sanghi
5,"Mc mereko nahi pata dekh le apne events ka mereko baksho….yahi keh kar bhagana padta tha tereko udghosh mein….but tera jaise josh toh maine kisi mein nahi dekha bhai. Hamesha haste hue milta tha tu, bas aise hi haste rahio bro. I am sure apan jarror milenge in the near future, Vishal Agarwal",Vishal  Agarwal,True,60a56e29819323d199d48655,Anshuman  Pal
6,"Bihari sale mauj kardi bhai same batch then same college bc...Bhai milna toh due hai tere sath aur bhand hona bhi :p. Tu toh purana yr hai bhai….love you bro, Vishal Agarwal",Vishal  Agarwal,True,60a65ca2819323d199d48eeb,Arpit Kumar Jhunjhunwala
7,"Tereko kuch log aashu bulate kuch pari(ye toh pata nahi kyu samjhaya nahi tu) but sale tu hai ek number ka mc pagla artist aadmi :p. Aur ye jo revelations hue hai last moments mein about the bdays and time of birth bc ajeeb feel ho raha bc ki sala kya alag level coincedence hai yr. Tu bhut chill aur mast launda hai bro one of the most genuine ones in the campus, aise hi rahio. Apne sare homies ka reunion mein toh jarrur milna hai, aur abhi toh kai late night games khelne baaki hai. Love you bro, Vishal Agarwal",Vishal  Agarwal,True,60a613da819323d199d48a18,Ashutosh  Kumar
8,"Yo bro,
Tune fraud jarrur mara udghosh mein but kehne wala mai hu toh chod dete iss topic ko :p. Duaon mein yaad rakhna, Vishal Agarwal
",Vishal  Agarwal,True,60a56f49819323d199d4865e,Atishay  Shrivastava
9,Abe aisa karte hai atul ko nikal dete hai :p. Hope ki aage bhi late night game nights mein milenge apan and hopefully in person too. Yours truly 'Trump' xD,Vishal  Agarwal,True,60a64d5a819323d199d48ddc,Atul  Arohi
10,"Ghissu bro, 
kya hi bolu tere bare mein yr!! 
Tere sath khele basketball ke matches, Tere sath Codefundo mein kari bakchodia (Tera choke slam nahi bhulunga mai :p), Tere sath late night LIF101 ki taiyaari (BTW Cycle mil gai thi finally) aur ML ke farji project ki presentation ki taiyari sab bhut jyada miss karunga bhai mai. 
Tere sath time spend karne mein alag hi maja aata tha, tu hi sabko ikatha karke group acticities karvata aur ha tu wing ka sabse bada mafia hai xD. Bhai please touch mein rahio, tu bhut chaapu hai aur tu age bhut jyada chaapne wala hai. I hope tu hyderabad aae, Lots of love to you bro, Vishal Agarwal
",Vishal  Agarwal,True,60a61163819323d199d489ed,Harshit  Garg
11,Ball ghum gai nahi toh century marr deta mai :p. Tera wicket due hai bro xD,Vishal  Agarwal,True,60a65ec0819323d199d48f17,Hitesh Kumar Singh
12,"Dekh bhai jay tu 22 ko ja 26 ko doesnt matter!! Corona toh ho hi gaya tereko itna mask lagane ke bavajood xD. Bhut maja aaya bro ter sath basketball khelne mein and aur bhi maja aaya jab tune shoulder tutwa liya tha :p. Aur ha mai score sahi count karta hu toh mereko harr bar fasa deta tha tu. Aur yr woh ball ghumm gai thi last day warna tereko zero par out kar hi deta mai :p. Bhut chaapu launda hai tu and aise hi chapte rahio. I hope ki apan fir mile for those late night basketball sessions and your fucking match winning 3 pointers. Lots of love to your bro, Vishal Agarwal",Vishal  Agarwal,True,60a579cd819323d199d4869f,Jay  Mundra
13,"Bhai still can’t believe Khaleel ahmed tere sath cricket khela hua hai!! Aur uss ebhi jyada ye cheez believe nahi hui mereko ki tu fast bowler hai cricket mein. Apan sath mein kabhi cricket nahi khele hai but maine tereko dekha hai daalte hue toh I think I was wrong :p. Tu hamesha haste hue milta tha bro and I hope ki ye hassi tu barkarar rakhega. Duaon mein yaad rakhna, Vishal Agarwal",Vishal  Agarwal,True,60a57aa8819323d199d486a8,Jitesh  Soni
14,"Mohit ‘baba’ tera woh late night randi rona aur human psychology ke lectures mai kabhi nahi bhulunga xD. Aur tera diya hua 2 din ka bed rest gym session ke bad ka toh katai bhul nahi paunga :p. Mereko pata hai apan touch nahi khoenge toh milte hai jald hi tere ‘Raj’ mein. Love you bro, Vishal Agarwal",Vishal  Agarwal,True,60a56bdd819323d199d48644,Mohit  Kumar
15,"Nikunj jaldi bady aaja😉, will miss those strenuous badminton games against you. Aur ha aage bad kar smash mat mara kar sale😂. Be in touch bro, Vishal Agarwal",Vishal  Agarwal,True,60a65938819323d199d48ea2,Nikunj  Kothari
16,"Prashant bhai, bhut innovative ways nikalta hai tu cheating karne ke liye :p. Maja aati bhai tere se baat karne mein, energetic feel karta mai. Apne ko toh abhi bhut aage tak sath jana hai bro. Stay tuned for all the late night procastination talks xD",Vishal  Agarwal,True,60a695bc819323d199d49108,Prashant  Chouhan
17,"Oe jindal jara idhar aaio!! :p Bhai khub maje kare yaar tere sath labs mein...you were a good sport thanks for keeping up with all of us. Duao mein yaad rakhna, Vishal Agarwal",Vishal  Agarwal,True,60a56aa7819323d199d48637,Rahul  Jindal
18,"Rohan bro, khub cheating kare bc apan yr, tu waise bhut hi overtalented chess player hai but I am sure tu mujhe nahi hara paega chess mein :p. Apna panda pc vishal club ko jinda rakhna hai bro aur I hope tu hyderabad post ho jae machana abhi kaafi hai mere dost!! Lots of love, Vishal Agarwal",Vishal  Agarwal,True,60a614e9819323d199d48a2a,Rohan Gupta (P Kumar)
19,"Sarthak sale desh drohi!! Bhut chaapu hai tu, aage bhi chaapte rehna. Meri treat due hai aur tere remoured harami thought bhi explore karne hai. Touch mein rahio",Vishal  Agarwal,True,60a6639e819323d199d48f61,Sarthak  Singhal
20,"Shashi bhai dhanyavad GI ki lab sambhalne ke liye….aur ha tu readings lelio mai chala lounge mein xD. Duaon mein yaad rakhna, Vishal Agarwal",Vishal  Agarwal,True,60a56baa819323d199d48642,Shashi  Shekhar
21,"Yadav ji, hamesha galat samey antaragni mein tumne bhand pakda hai, peshe se police wale hone chahiye the tum. But honestly yr you are one of the most grounded and humble person of the whole batch. Aise hi rahio bro. Lots of love, Vishal Agarwal",Vishal  Agarwal,True,60a57361819323d199d4867c,Shreyansh  Yadav
22,"Asati bhai tu cement bhut aacha banata hai xD. Tere group mein hone se humare group se koi bhedta nahi tha :p. Tu bro one of the finest person on the campus hai, Duaon mein yaad rakhna bro, Vishal Agarwal",Vishal  Agarwal,True,60a577a1819323d199d48692,Siddhant Jain Asati
23,"Bansal Sir, kaise ho!! Bhut nightouts mare bhai tere sath first year summer mein, unfortunately ‘planned’ milna kam hua. Btw tu ek meeting bhul gaya jo apan oracle ke interview mein mile the jisme tune exit mara tha :p. And i still cant figure out ki tu among us mein puri kahani kaise solve kar leta tha?? Tere se milne par ek soothing effect aata hai bro and never ever apne iss aura ko marne mat dena. I seriously hope ki apan future mein mile bhai. Love you bro, Vishal Agarwal",Vishal  Agarwal,True,60a5716b819323d199d4866e,Sudhanshu  Bansal
24,"Vipul boi, tera woh first nightout life ka summer mein aur tera bina bhund hue subeh ka hangover mereko hamesha se yaad rahega. Will miss those long stressful nights boi, aise hi chapte rahio and I know future mein apan jarrur milenge, Vishal Agarwal",Vishal  Agarwal,True,60a56ade819323d199d48638,Vipul  Shankhpal
25,"Kitna ajeeb hasta hai sale tu, particularly teri wajeh se vipul ki jyada marte the hum kyuki teri hassi se aadha group automatcially hass deta tha. But honestly yaar tu bhut khush mijaj launda hai, aise hi rahio bro. Milte hai kabhi vipul ki marne ke liye :p",Vishal  Agarwal,True,60a57841819323d199d48696,Utkarsh  Singh
26,"Abe pratap sale design head ho karke bhi tune itna jhaatu map kaise banaya yr 😂 😂  Tera ye moment ka khissiana mai kabhi nahi bhulunga. Tere woh early morning chats jisse tu hunt karta tha woh toh epic the. Aur ha mai aa raha tere hall treat lene toh bhagg mat jaio, Lots of love to you bro, Vishal Agarwal",Vishal  Agarwal,True,60a56b7f819323d199d48640,Vaibhav  Pratap
27,"Vikram mc assignment bhej nahi toh room aa raha mai :p. Bhut maje kare bhai labs mein, Touch mein rahio Lots of love, Vishal Agarwal",Vishal  Agarwal,True,60a56b50819323d199d4863e,Vikram  Singh
28,"Oe Shukla!! Jara baby doll par nach ke dikha yr 😂  Tere woh steps main kabhi nahi bhulunga xD. Aur teri maggi wli treat toh koi bhi nahi bhul sakta, agli bari milio toh startup register karke hi milio :p, Tab tak chaapte rahio, Vishal Agarwal
",Vishal  Agarwal,True,60a56b2d819323d199d4863d,Vineet  Shukla
29,"Aur be Techkriti ke bade khiladi kaisa chal raha hai...bhut maje liye bhai tere labs mein aur teri wajeh se hi labs bearable bani sabke liye so thanks for that :p. I hope apan jarrur milenge bhai, Vishal Agarwal",Vishal  Agarwal,True,60a56aff819323d199d4863b,Vipul Kumar Singh
