,text,author,visibility,_id,recipient_name
0,"Areh Ankur.. 
Tere Ghar ke aam boht bakchod the be.. 
My movie companion, saare bakchod movies ke discussion ho, yaa saath me movies dekhna ho, tu hii tha saathi mera.
Mulholland Drive, Goodfellas aur shyad John Wick bhi. 
Vo Pictionary vale din 🔥🔥 aur shiv ji ke paas jaane vali raat. Aakhir me, 'Red Green crayon' kese draw karna hai, abhi tak pata Nahi Chala!
",Ankan  Das,False,60a6842d819323d199d4909f,Ankur  Vatsa
1,"Abe Chu****
Hindi sikahne aata hai, aur khud hii ko Nahi aata.
Abe tune toh acting bhi Kar rakha hai, under the supervision of Pitaji Ankan.
Tera Minion gift Kar dena.. And.. Able Saal, Holi me party karenge!!",Ankan  Das,True,60a681e7819323d199d49095,Anukant  Singh
2,"Yoooo... Yaad hai Final me pohche the, Institute Football League me.. 
You're my DC teacher, learned a lot from you bro!!",Ankan  Das,True,60a6803e819323d199d4908c,Brijesh  Kaler
3,"Yooooo... Me bhul gaya hum kese mile first time. But Fest ke time teri yaad aati thi.. to get suggessions... LOL
Khush mat ho, Never worked!!",Ankan  Das,True,60a67ebe819323d199d49080,Chitranshi  Singh
4,"Arehhh Rajnikanta... 
Morning Alarm.. Parte kaa.. aur eventually, humara.. Yaad hai tune Shimla trip me ulti saaf Kiya tha.. bohot funny tha 🤣🤣
Jo bhi hai, tu hai mere wing kaa football buddy, Saath me football Dekha, discuss Karna and khelna bhi.. Yaad rahega mere dost!! 
Me bas tere liye lunch Karne jaata tha.. kyuki tu bulata tha.. ",Ankan  Das,True,60a6867f819323d199d490b3,Rajani Kanta Nayak
5,"Heyyy broo..
Hum first mile the Mime practice Karne.. Yaar bohot mehnat kiya tha tune Chor vale role ke liye aur kya hii bakchod performance diya tha Auditorium me..  One of the most humble guy in college.
Milte hai Kabhi !! ",Ankan  Das,False,60a6915b819323d199d490e9,Ratnesh  Argal
6,"Areh brooo.. 
Shimla trip bada miss karunga.. tera room tha exclusively party Karne ke liye.. 
Tera white board thaa hii Pictionary ke liye and us board ne ese ese drawing dekhe kii vo kabhi nahi bhulega!! 
",Ankan  Das,True,60a6857d819323d199d490ab,Sanket  Gaggar
