,text,author,visibility,_id,recipient_name
0,"aur anukant.... kya haal hai
samay ka to kaam hi hai nikalna..... aur samay se karmath to koi hai hi nhi
dekhte dekhte 4 saal nikal hi gya (nikalna hi tha)
kaafi badhiyan raha yaar ye time
saala ye likh rahe hain aur bagal wale ghar se tera alarm (besharmi ki height) baj raha haiЁЯШВЁЯШВ (divine intervention)
jyada to kya hi likhenge...... milte hain jaldi..... karte hain party",Ankur  Vatsa,True,60a3d2e9819323d199d47f9d,Anukant  Singh
1,"pehli baar to Kota me hi mile the.... (lekin bas mile hi the.... None of us knew that the journey was not over, that we would meet again and under pawry circumstances).
50 days of quarantine par ek kitaab likhi ja sakti hai....... aur Lala Halwai ke bina wo kitaab na to shuru ho payegi aur na khatam.
4 saal to khatam ho gye..... lekin apni journey abhi shuru hui hai....50 days of quarantine was a start and it will not end until there is an endless streak of pawwriessss. (We fight till the end).
Do baatein humesha yaad rakhna aur jeevan sukhi rahega
Valar Morghulis
Valar Dohaeris
",Ankur  Vatsa,True,60a3d8a2819323d199d47fa8,Bhavesh  Loungani
2,"Roller bhaiya ko pranam.....
First year me sath baith ke psychological thrillers par dimag kharab karna shuru kiye the hum log........ mereko The Sixth Sense ka climax scene abhi bhi yaad hai.... Hum dono bas dekhte reh gaye the ki Wtf just happened.
Second year end me tune hi debut karaya........ Third year me debutants pro ban gye.......... aur final year me MHCD.
2 hi logon ke rolling perfection ka fan hun main.... unme se ek tu hai 
Khair sath to lamba rahega apna
Milte hain jald..... naye andaz aur purane jazbaat mein
",Ankur  Vatsa,False,60a56a60819323d199d48634,Jayesh  Narwaria
3,"рдФрд░ рдХреГрд╖реНрдгрд╛, рд╕рдм рдмрдврд┐рдпрд╛рдБ ?
рддреБрдореНрд╣рд╛рд░реЗ рд╕рд╛рде рдЗрд╕ рд╕рдлрд░ рдХреА рд╢реБрд░реБрдЖрдд рдЧреИрд▓реЗрдХреНрд╕реА рд╕реЗ рд╣реБрдИред рдкрд▓рдЯ рдХрд░ рджреЗрдЦ рд░рд╣рд╛ рд╣реВрдБ рддреЛ рдорд╣рд╕реВрд╕ рд╣реЛ рд░рд╣рд╛ рд╣реИ рдХреА IIT рдХрд╛рдирдкреБрд░ рдХреЗ рдХрд╛рд░рд╡рд╛рдВ рдореЗрдВ рдЗрд╕ рд╕рдлрд░ рдиреЗ рдпрд╛рджреЛрдВ рдХреЗ рдХрд╛рдлрд┐рд▓реЗ рдХреЛ рдЬрдЧрдордЧрд╛ рджрд┐рдпрд╛ рд╣реИред рдмрд╛рддреЗрдВ рдФрд░ рдпрд╛рджреЗрдВ рддреЛ рдмрд╣реБрдд рд╣реИрдВ, рд▓реЗрдХрд┐рди emotional рд╣реЛ рдЬрд╛рдПрдВрдЧреЗ, рдЕрдЧрд░ рд╕рднреА рд▓рд┐рдЦреЗрдВрдЧреЗ рддреЛред 
рдЦреИрд░, рдПрдХ рдкреЬрд╛рд╡ рдХрд╛ рдЕрдВрдд рд╣реБрдЖ рд╣реИ рдФрд░ рди рдЬрд╛рдиреЗ рдХрд┐рддрдиреЗ рдкреЬрд╛рд╡ рдЖрдиреЗ рдмрд╛рдХреА рд╣реИрдВред рд▓реЗрдХрд┐рди рдореБрд▓рд╛рдХрд╛рдд рдЬрд╣рд╛рдБ рднреА рд╣реЛрдЧреА рддреАрди рдпрд╛ рд╕рд╛рдд рдорд┐рдирдЯ рдХреЗ рдЕрдВрддрд░рд╛рд▓ рдкрд░ рд╣реА рд╣реЛрдЧреАред 
рдФрд░ рд╣рд╛рдБ........... MARATHAS рдХрд╛ рдЯреЗрдореНрдкреЛ рд╣рд╛рдИ рд╣реИ...............  ",Ankur  Vatsa,True,60a3c6e1819323d199d47f6f,Krishna  Deo
4,"Aur Rajni bhai........
Ncc ke time se hi backup alarm clock tu rehta thaЁЯШВ
kaafi samay nikal gya uske baad (bc pure 4 saal hi nikal gye) lekin yaadein ban gyi.
5th year me jyada parties to nhi ho payengi shayad.
waise mereko bohot khushi hai ki jate jate tere sath bhi party ho gyi.....
Chalte hain kabhi sath mein LAUNCH karne phir ek baarЁЯШВЁЯШВЁЯШВ",Ankur  Vatsa,True,60a56f20819323d199d4865b,Rajani Kanta Nayak
5,"aur sanket kaisa hai bhai....              
4 saal sath hi rahe hum log.... to ekdum family type wala bonding ho hi gya tha
meko yaad aa rha hai abhi ki kaise tum humesha naye ideas ke sath excitement me aata tha..... aur mera reaction rehta tha 'dekhte hain yaar'ЁЯШЕЁЯШЕ
Khair saare ideas to implement nhi hue..... par party wale to lagbhag sare ho hi gye.
Ek naya universal khana choose kar liyo ab kyonki Japan me maggi aur bhel to milega nhiЁЯШЕ
Baaki to milte hain...... karte hain party",Ankur  Vatsa,True,60a565fe819323d199d4860f,Sanket  Gaggar
6,"Aur bhai jugaadu pro max..... kaisa hai bhai....
kaafi jugaad karaya hai bhai tune (jugaad na bhi ho to koshish to puri ki tuneЁЯШВЁЯШВ)
khair jugaad to bas ek aspect raha hai..... baki choti si wing apni bakchod rahi yaar first year se hi aur repi to bakchod launda tha hi (jo kahi bhi maar karne ko humesha taiyar rehta thaЁЯШВЁЯШВ)
khushi hai iss baat ki ki kaanch tehas nahas ho gya..... gham hai ki anukant ka guitar nahi tod payeЁЯШВЁЯШВ
aakhri pachas din to bakchod rahe bhai (Wing photoshoot aur wing party to humesha yaad rahegi)... matlab maza hi aa gya
milte hain jald hi sab phir.........",Ankur  Vatsa,True,60a56d27819323d199d4864c,Yadu  Sharma
