,text,author,visibility,_id,recipient_name
0,"oyeee bsdk ooo ooyee maderchod .... 
Antaragni me manager kya ban gya bc akdam se waqt badal diye , jazbaat badal diye, zindgi badal di.  
manager->l**e story->acads ...kya chapa h bc
ye special story knha se suru hue pta hi hoga ....library me pdh rhe the  fir puppy love pe matter suru fir tune jo status dala usne to aag hi lga di....
jab bhi bate ho ...... bc phle relationship ki bate baki chije ma chudaye 
last sem jab tere room per mile the ...full discussion on babu sona mona

chlo thodi acads ki baate ki jaye..............
phle to beta tu only passing ke liye pdhta tha  fir teri gand me pta nhi kisne ungli kri ..... 
 tu bc A se niche bat hi nhi krta , ak sem (7th) me spi double.
jab se tu pdhne lga h.... m hello iitk open krna band kr diya, 
ye last 2 sem tune hi pass kraye h 

ye sab etna change..may be ... aurat ka chakar babu bhaya aurat ka chakar
bc ab to esa chal rha...jidhar tu hath dal rha vo tera

change:  gandu, chodu -> serious and dedicated",Jaysingh,True,60a64bb8819323d199d48dc0,Abhishek  Maddheshiya
1,"jitu bahi jitu .... rato rat crorpati bnane vale scheme ke chakar me mile the, lekin tu bna nhi bc bach gya
2nd year summer me .. world cup chal rha tha .... subh se sham tak sunil k room m dera .
match chal hi rha hota, bich bich me mere khaternak dialogue. ad me jo mst mst item aate .... alag hi mahol ho jata bc . 
tera coaching vala toru lobe ... vese babhiji bhoooot mst h ....... but ab pta nhi kis direction me ja rha h  ye toru lobe ....
vese tu ab IAS ban hi jayega to ..... thukra k mera pyar mera entkam dekhegi",Jaysingh,False,60a65a91819323d199d48ebf,Jitendra  Jakhar
2,"1st year me L20 mile the , tu mil gya tha time pe vrna abhi tak 1st year ke course kr rha hota.
tune 1st year me ham kafi logo ko pdha pdha k pas kraya h .... ramu, aman, shiv, pankaj,...
exam k time cc me apni hi mandli rhti thi , kafi logo ko pdhaya h tune or bhrosa bhi rhta tha ki bc pass to kra dega. uske bad sath me world cup dekhte the tere room pe 
last sem me teri nagin style me bowling ka kafi samna kiya h .... finally OAT ke piche se kud k aa gye ghar",Jaysingh,False,60a66551819323d199d48f7d,Sunil  Kumar
